{
  "schema_version": "1.0",
  "generated_at": "2026-10-02T10:00:00Z",
  "instrument": {
    "id": "somerton-processor-dpa-2026-10",
    "label": "Somerton Retail GmbH / Kestrel Fulfilment Ltd — Data Processing Agreement",
    "type": "DPA",
    "language": "EN"
  },
  "mode": "REVIEW_QUICK",
  "art28_coverage": [
    {"obligation": "chapeau", "status": "PASS"}
  ],
  "annex2_toms": {"present": true, "toms_art32_assessed": false},
  "transfers": {"in_scope": false},
  "outcome": {"compliant": true, "recommendation": "sign"}
}
