{
  "schema_version": "1.0",
  "generated_at": "2026-10-02T10:00:00Z",
  "instrument": {
    "id": "fennimore-commercial-dpa-2026-10",
    "label": "Fennimore Retail Ltd / Ashgrove Analytics Inc — Commercial DPA",
    "type": "DPA",
    "language": "EN"
  },
  "mode": "REVIEW_QUICK",
  "tier": 1,
  "art28_coverage": [
    {"obligation": "chapeau", "status": "PASS"}
  ],
  "annex2_toms": {"present": true, "toms_art32_assessed": true},
  "transfers": {"in_scope": true, "mechanism": "dpf"},
  "outcome": {"compliant": true, "recommendation": "sign"}
}
