{
  "schema_version": "1.0",
  "generated_at": "2026-10-02T10:00:00Z",
  "instrument": {
    "id": "palisade-hybrid-dpa-2026-10",
    "label": "Palisade Health Group / Arcway Cloud Ltd — Hybrid DPA with transfer-SCC Annex",
    "type": "DPA",
    "language": "bilingual"
  },
  "mode": "DRAFT",
  "tier": 3,
  "annex2_toms": {"present": true, "toms_art32_assessed": true},
  "transfers": {"in_scope": true, "scc_module": "module-2-controller-to-processor"},
  "outcome": {"compliant": false, "recommendation": "escalate_to_review_neg"}
}
